pregunta,respuesta
"hola","Hola! ¿Cómo puedo ayudarte hoy?"
"buenos días","¡Buenos días! ¿En qué puedo asistirte?"
"qué puedes hacer","Puedo responder preguntas y ayudarte con información sobre seguridad electrónica."
"cuáles son tus funciones","Respondo consultas y brindo información sobre instalación de seguridad."
"quiero instalar cámaras","Ofrecemos guías de instalación para cámaras de seguridad."
"cuánto cuesta instalar una cámara","El costo depende del tipo de cámara y la instalación."
"necesito ayuda con una alarma","Dime qué problema tienes con la alarma y te ayudaré."
"cómo configuro una cámara IP","Para configurar una cámara IP, necesitas conectarla a la red y acceder a su interfaz web."
"cuál es la mejor marca de cámaras","Algunas marcas recomendadas son Hikvision, Dahua y TP-Link."
"ofrecen soporte técnico","Sí, tenemos soporte para la instalación y configuración de dispositivos."
"tienes guías de instalación","Sí, contamos con manuales y tutoriales para instalar sistemas de seguridad."
"puedo monitorear mi casa desde el celular","Sí, con una cámara IP y una aplicación móvil puedes monitorear tu casa en tiempo real."
"necesito ayuda con mi DVR","Claro, ¿cuál es el problema con tu DVR?"
"cuál es la diferencia entre DVR y NVR","El DVR se usa para cámaras analógicas y el NVR para cámaras IP."
"qué es un CCTV","CCTV significa Circuito Cerrado de Televisión y se usa para videovigilancia."
"puedo instalar una alarma yo mismo","Sí, pero es recomendable seguir una guía de instalación o consultar a un profesional."
"cuánto tarda en instalarse un sistema de seguridad","Depende del tamaño del sistema, pero suele tomar entre unas horas y un día."
"me puedes recomendar una cámara","Depende de tus necesidades. Para casa, una cámara WiFi es buena opción."
"las cámaras tienen visión nocturna","Sí, muchas cámaras tienen infrarrojos para visión nocturna."
"es seguro usar una cámara WiFi","Sí, pero debes cambiar la contraseña predeterminada y usar cifrado WPA2."
"puedo conectar varias cámaras a un NVR","Sí, según el modelo de NVR, puedes conectar de 4 a 32 cámaras."
"las cámaras se pueden ver en el televisor","Sí, si el DVR o NVR tiene salida HDMI o VGA."
"hay cámaras sin cables","Sí, existen cámaras de seguridad inalámbricas con batería recargable."
"puedo hablar a través de una cámara","Sí, algunas cámaras tienen audio bidireccional."
"qué pasa si se va la luz","Si tienes un sistema con batería de respaldo, seguirá funcionando."
"puedo grabar las imágenes en la nube","Sí, algunas marcas ofrecen almacenamiento en la nube."
"cuánto tiempo se almacenan las grabaciones","Depende del disco duro y la configuración, puede ser de días a semanas."
"se pueden detectar movimientos","Sí, muchas cámaras tienen detección de movimiento y envío de alertas."
"las alarmas pueden conectarse al celular","Sí, muchas alarmas inteligentes permiten control desde el móvil."
"qué hago si mi cámara no graba","Revisa la configuración del almacenamiento y el estado del disco duro o la tarjeta SD."
"puedo instalar una cámara en exteriores","Sí, pero debe ser resistente al agua y polvo (IP66 o superior)."
"cuál es la mejor ubicación para una cámara","Depende del área que quieras cubrir, pero deben estar en puntos estratégicos y altos."
"puedo conectar una cámara a Alexa","Sí, algunas cámaras son compatibles con Alexa y Google Assistant."
"hay alarmas sin cuotas mensuales","Sí, hay alarmas que solo requieren compra inicial y no tienen suscripciones."
"cómo mejorar la seguridad de mi casa","Puedes instalar cámaras, alarmas y reforzar puertas y ventanas."
"las cámaras necesitan internet","Las cámaras IP sí, pero las analógicas funcionan sin internet."
"las grabaciones se pueden borrar automáticamente","Sí, la mayoría de los sistemas sobrescriben los videos antiguos."
"¿Cuáles son los tipos de cámaras de seguridad?","Existen cámaras analógicas, IP, térmicas, PTZ, y cámaras con inteligencia artificial."
"¿Las cámaras de seguridad pueden grabar sin internet?","Sí, las cámaras analógicas y algunas IP pueden grabar en un DVR/NVR sin conexión a internet."
"¿Cuántas cámaras necesito para una casa?","Depende del tamaño y las zonas a cubrir, pero generalmente se recomienda al menos 4 cámaras."
"¿Cómo instalar un sistema de videovigilancia?","Debes elegir la ubicación de las cámaras, conectar los cables al DVR/NVR y configurar la red."
"¿Las cámaras necesitan fuente de alimentación?","Sí, las cámaras cableadas requieren un adaptador de corriente o alimentación PoE."
"¿Cómo mejorar la calidad de imagen de mi cámara?","Asegúrate de limpiar la lente, ajustar la resolución y verificar la iluminación."
"¿Qué tipos de alarmas existen?","Hay alarmas cableadas, inalámbricas, con monitoreo profesional y autogestionadas."
"¿Cómo funciona un sensor de movimiento?","Detecta cambios en el ambiente mediante infrarrojos o microondas y activa la alarma."
"¿Puedo recibir alertas en mi celular?","Sí, las alarmas y cámaras inteligentes envían notificaciones mediante una app."
"¿Qué significa resolución en cámaras?","Es la cantidad de píxeles en la imagen. HD (720p), Full HD (1080p) y 4K son resoluciones comunes."
"¿Cómo evitar hackeos en cámaras IP?","Usa contraseñas seguras, actualiza el firmware y desactiva accesos remotos no necesarios."
"¿Se puede detectar si una cámara está siendo hackeada?","Sí, si notas luces inusuales, movimientos extraños o actividad desconocida en la app."
"¿Qué es un sistema de CCTV?","Un sistema de CCTV (Circuito Cerrado de Televisión) es un sistema de vigilancia que utiliza cámaras de video para monitorear un área."
"¿Cuál es el propósito de un sistema de CCTV?","El propósito de un sistema de CCTV es proporcionar vigilancia y seguridad en un área, detener posibles delitos y ayudar en la investigación de incidentes."
"¿Qué tipos de cámaras de CCTV existen?","Existen varios tipos de cámaras de CCTV, incluyendo cámaras de dominio público, cámaras de infrarrojos, cámaras de movimiento y cámaras de red."
"¿Qué es un sistema de alarma?","Un sistema de alarma es un sistema que detecta y alerta sobre posibles amenazas o intrusiones en un área."
"¿Cuál es el propósito de un sistema de alarma?","El propósito de un sistema de alarma es alertar sobre posibles amenazas o intrusiones en un área y proporcionar una respuesta rápida y efectiva."
"¿Qué tipos de sistemas de alarma existen?","Existen varios tipos de sistemas de alarma, incluyendo sistemas de alarma de movimiento, sistemas de alarma de sonido y sistemas de alarma de video."
"¿Qué es un sistema de control de acceso?","Un sistema de control de acceso es un sistema que controla quién puede acceder a un área o recurso."
"¿Cuál es el propósito de un sistema de control de acceso?","El propósito de un sistema de control de acceso es controlar quién puede acceder a un área o recurso y proporcionar una capa adicional de seguridad."
"¿Qué tipos de sistemas de control de acceso existen?","Existen varios tipos de sistemas de control de acceso, incluyendo sistemas de control de acceso de tarjeta, sistemas de control de acceso de huella digital y sistemas de control de acceso de reconocimiento facial."
"¿Qué es un bot de seguridad?","Un bot de seguridad es un programa de software que utiliza inteligencia artificial para proporcionar seguridad y vigilancia en un área."
"¿Cuál es el propósito de un bot de seguridad?","El propósito de un bot de seguridad es proporcionar seguridad y vigilancia en un área, detectar posibles amenazas o intrusiones y alertar sobre incidentes."
"¿Cómo puedo acceder a mi sistema de CCTV?","Puedes acceder a tu sistema de CCTV a través de una aplicación móvil o una interfaz web."
"¿Cómo puedo recibir notificaciones de mi sistema de alarma?","Puedes recibir notificaciones de tu sistema de alarma a través de una aplicación móvil o un correo electrónico."
"¿Cómo puedo controlar quién puede acceder a mi área?","Puedes controlar quién puede acceder a tu área a través de un sistema de control de acceso."
"¿Cuál es tu experiencia con integración de IA en WhatsApp?","He desarrollado chatbots usando Node.js y TensorFlow.js para responder preguntas automáticamente en WhatsApp."
"¿Cómo manejas el entrenamiento de modelos de IA en producción?","Utilizo TensorFlow.js y ajusto hiperparámetros para mejorar la precisión del modelo de NLP."
"¿Qué técnicas utilizas para el procesamiento de lenguaje natural?","Uso tokenización, lematización y embeddings de palabras para mejorar la comprensión del chatbot."
"¿Cómo manejas la extracción de datos en tiempo real?","Uso web scraping con Puppeteer y Cheerio para obtener datos de sitios web en tiempo real."
"¿Qué tecnologías utilizas para desarrollar chatbots?","Trabajo con Node.js, TensorFlow.js y la API de WhatsApp Business para crear asistentes conversacionales."
"¿Tienes experiencia en entrenamiento continuo de modelos de IA?","Sí, implemento reentrenamiento automático cada cierto tiempo para mejorar la precisión del chatbot."
"¿Cómo optimizas el rendimiento de un chatbot?","Mejoro la velocidad con embeddings eficientes, cacheo de respuestas y optimización de consultas a la base de datos."
"¿Has trabajado con bases de datos para chatbots?","Sí, he usado MongoDB y PostgreSQL para almacenar interacciones y respuestas en chatbots."
"¿Cómo manejas el despliegue de modelos de IA?","Uso servidores en la nube y contenedores con Docker para implementar modelos de IA en producción."
"¿Cómo manejas la seguridad en chatbots de WhatsApp?","Implemento validación de usuarios, cifrado de mensajes y restricciones de acceso para proteger los datos."
"¿Cómo estructurarías un chatbot para atención al cliente?","Diseñaría un flujo con preguntas frecuentes, integración con agentes humanos y análisis de sentimiento."
"¿Cómo manejas la generación de respuestas en un chatbot?","Uso redes neuronales para generar respuestas dinámicas y manejo respuestas predefinidas para mayor precisión."
"¿Qué experiencia tienes con modelos de clasificación de texto?","He trabajado en modelos de clasificación de intenciones para mejorar la precisión de los chatbots."
"¿Cómo manejas respuestas ambiguas en un chatbot?","Implemento modelos de confianza para detectar incertidumbre y solicito aclaraciones al usuario."
"¿Cómo mejorarías la interacción de un chatbot con los usuarios?","Usaría procesamiento de lenguaje natural avanzado y análisis de sentimiento para mejorar respuestas."
"¿Cómo manejarías la personalización en un chatbot?","Almacenar historial de interacciones y preferencias del usuario para respuestas más adaptadas."
"¿Has trabajado con integración de APIs en chatbots?","Sí, he integrado APIs de pago, soporte técnico y bases de datos para mejorar la funcionalidad del chatbot."
"¿Cómo entrenas un chatbot para entender diferentes formas de preguntar?","Uso expansión de sinónimos y embeddings para reconocer preguntas con el mismo significado."
"¿Cómo optimizas el costo de operación de un chatbot en la nube?","Utilizo instancias serverless y ejecuto modelos de IA en el cliente cuando es posible."
"¿Cómo manejas el análisis de datos de un chatbot?","Recojo métricas sobre interacciones y uso análisis de sentimiento para mejorar respuestas."
"¿Qué es un sistema de videovigilancia?","Es un conjunto de cámaras y dispositivos que permiten monitorear un área en tiempo real o grabar imágenes para su revisión posterior."
"¿Cuáles son los componentes principales de un sistema de CCTV?","Las cámaras, el DVR/NVR, los cables de conexión, las fuentes de alimentación y el software de monitoreo."
"¿Cuál es la diferencia entre un DVR y un NVR?","El DVR se usa con cámaras analógicas, mientras que el NVR es para cámaras IP que transmiten datos por red."
"¿Qué factores considerar al instalar cámaras de seguridad?","Ubicación, iluminación, tipo de cámara, ángulo de visión y almacenamiento de grabaciones."
"¿Qué es una cámara IP?","Es una cámara que transmite video a través de Internet o una red local sin necesidad de un DVR."
"¿Cuáles son las ventajas de un sistema de seguridad inalámbrico?","Fácil instalación, flexibilidad en la ubicación de las cámaras y menor necesidad de cableado."
"¿Cómo funciona un sistema de control de acceso?","Regula la entrada y salida de personas mediante tarjetas, huellas dactilares o reconocimiento facial."
"¿Qué es la autenticación biométrica en seguridad?","Es el uso de características únicas como huellas dactilares o reconocimiento facial para el acceso."
"¿Cuál es la diferencia entre cámaras analógicas y digitales?","Las analógicas requieren un DVR para grabar, mientras que las digitales (IP) envían video a través de redes."
"¿Cómo mejorar la seguridad de una red de videovigilancia?","Usar cifrado de datos, cambiar contraseñas predeterminadas y restringir el acceso a la red."
"¿Qué es un sensor de movimiento en alarmas?","Es un dispositivo que detecta cambios en el entorno y activa una alerta en caso de intrusión."
"¿Cómo funciona un sistema de alarma perimetral?","Utiliza sensores en puertas, ventanas o cercas para detectar accesos no autorizados y activar una alerta."
"¿Qué es la domótica en seguridad?","Es la automatización del hogar o empresa para controlar dispositivos de seguridad de forma remota."
"¿Cómo evitar falsas alarmas en un sistema de seguridad?","Ajustando la sensibilidad de los sensores y evitando colocarlos en zonas con movimiento constante."
"¿Qué mantenimiento requieren los sistemas de seguridad?","Revisión periódica de cámaras, actualización de software y comprobación del almacenamiento."
"¿Cuál es la mejor ubicación para instalar una cámara de seguridad?","En entradas, pasillos, áreas de alto tráfico y puntos estratégicos con buena visibilidad."
"¿Cómo almacenar grabaciones de seguridad por más tiempo?","Usando discos duros de alta capacidad, almacenamiento en la nube o configurando grabación por eventos."
"¿Cuál es la función de un UPS en sistemas de seguridad?","Mantiene el sistema operativo en caso de fallas eléctricas, evitando interrupciones en la vigilancia."
"¿Cómo proteger un sistema de seguridad contra ciberataques?","Usando contraseñas seguras, cifrado de datos y redes separadas para los dispositivos de seguridad."
"¿Qué es la inteligencia artificial en videovigilancia?","Es el uso de algoritmos para detectar movimientos sospechosos, reconocer rostros y analizar comportamientos."
"¿Qué beneficios tiene un sistema de seguridad con monitoreo remoto?","Permite visualizar cámaras en tiempo real desde cualquier lugar y recibir alertas en caso de eventos sospechosos."
"¿Cómo integrar un sistema de seguridad con un asistente de IA?","Mediante API de reconocimiento facial, análisis de patrones y alertas automáticas basadas en eventos."
"¿Qué es un sistema de detección de incendios?","Es un conjunto de sensores y alarmas que detectan humo o temperatura elevada y alertan sobre posibles incendios."
"¿Cuáles son los protocolos de seguridad en una empresa?","Control de acceso, monitoreo por cámaras, registro de visitantes y capacitación del personal en seguridad."

